<?xml version="1.0" encoding="UTF-8"?>
<!--
To change this template, choose Tools | Templates
and open the template in the editor.
-->

<!DOCTYPE gBlasterProperties PUBLIC 'PUBLIC:-//gBlaster/Properties//EN' 'driver.dtd'>
<gBlasterProperties>
    <DBConnection url="localhost" login="gblaster" password="gblaster"/>
    <BlastProperties>
        <PathToMakeBlastDb path="/bin/makeblastdb"/>
        <PathToBlastP path="/bin/blastp"/>
        <Expect value="1"/>
        <MinORFLength min="100"></MinORFLength>
        <MaxORFLength max="10000"></MaxORFLength>
    </BlastProperties>
    <Genome>
        <Name name="ecoli"/>
        <PathToFile path="/home/alext/Documents/gBlaster/genomes/ecoli.fasta"/>
        <GeneticTable type="standard"/>
    </Genome>
    <Genome>
        <Name name="human_mito"/>
        <PathToFile path="/home/alext/Documents/gBlaster/genomes/hmito.fasta"/>
        <GeneticTable type="standard"/>
    </Genome>
</gBlasterProperties>